10,ADS,"http://www.bing.com/cr?IG=A957A4372E4540B5B95C3A51F569E048&CID=12F1C3FAD8D06EF729FDC9FBD9E16FA5&rd=1&h=kVmrEsLGTsVqf16lhWxUCYzAacMjMyyM8eIglQEGsq0&v=1&r=http%3a%2f%2fdigiday.com%2fbrands%2fworst-10-ads-2016%2f&p=DevEx,5041.1",Mark Duffy has written the Copyranter blog for 11 years and is a freelancing copywriter with 25-plus years of experience. His hockey wrist shot is better than yours. This was a difficult shitlist to compile because 2016 produced a shitpile of shitty ads ...,"Mark Duffy has written the Copyranter blog for 11 years and is a freelancing copywriter with 25-plus years of experience. His hockey wrist shot is better than yours.
This was a difficult shitlist to compile because 2016 produced a shitpile of shitty ads; the biggest, shittiest ad shitpile ever. Imagine a Tower of Babel made of shit, filled with a shit-ton of shit-talking marketing shitheads senselessly shouting out every window about their shit-awful ads, non-stop. That was The Year in Advertising, 2016.
Therefore, this just needed to be done. And here they are: The bottom 1o ads of 2016, from least worst to worst worst.
Advertisement
10. Am/Pm Organic Cafe, Nepal, “Flowchart”
I could go into the logic of this headache of a flowchart billboard (note that if you have a problem and can’t do anything about it, there is a line up to their logo, but no arrow), but I’d rather just take a 50 cal Gatling gun to it. Found on reddit.
9. Apartments.com, “Apartments Alert”
VIDEO
Remember Max Headroom? I liked him (although he was mistakenly used to try to save New Coke), and his name was creative. Brad Bellflower is not creative or funny or interesting or relevant or useful. I just want to punch his face through the back of his skull. Agency: RPA.
8. Ignite Instant Light Charcoal, “Fly”
From agency DDB South Africa’s press note: “Ignite…catches alight so fast that an insect sitting on one of the coals would be incinerated before it could fly away.” (This is a lie.)
How about 25 insects? And would my steak then have an aftertaste of burnt fly? Why not put a couple of cockroaches in the ad, too? Maybe a dung beetle.
7. American Express, “Tina Fey’s Guide To Workout Gear”
VIDEO
Maybe the most embarrassingly unfunny commercial of 2016. I hope Fey didn’t help with the writing. But the script isn’t what got this spot in the bottom 10. It’s how much shit she bought, how obnoxiously Amex shoves hyper-consumerism into our less-rich-than-Fey faces. Buy! Buy! BUY!
6. Mellow Mushroom Pizza Bakers, “Clinically Proven”
VIDEO
Parodying Erectile Dysfunction ads (badly) to sell pizza is a brilliant move, said nobody with or without penis, ever. Agency: BooneOakley, Charlotte.
5. Secret, “Raise”
VIDEO
“Feminine” brands pandering to millennial women mean well, buy they mostly don’t execute well. And this very uncomfortable spot portrays our hero as, well, a very stupid person. Here’s a more in-depth take on why the ad sucks from a smart millennial woman. Note: this whole Pandering Awkwardly To Young Women Femvertising Movement is Dove’s fault.
4. and 3. (tie) Pizza Hut “#PizzaBump” and Bergedorfer Beer, “Pregnant”
VIDEO
The spot, via Grip Limited, Toronto, is for Pizza Hut’s “Triple Treat Box.” And, see, these men have eaten so many pizzas that they got so fat that they look pregnant, but are not, but are probably close to death.
These ads, by Jung von Matt, Hamburg, are for Bergedorfer Beer. And, see, these alcoholics have drunk so much of the beer that they have massive beer guts that make them look pregnant. They are also close to death. And not pregnant.
The “pregnant male” is such a refreshing, original, game-changing, crackerjack of a creative linchpin, isn’t it?
2. Facebook “station takeover”
Image via: Instagram.
Facebook did this “takeover” execution in a few stations worldwide. Nothing dehumanizingly dystopian about this experience. Also, it’s not at all a scary metaphor for Facebook’s ultimate goal of taking over your life 100 percent, 24/7. The next step in this campaign is, you will see your own Facebook page updates on the walls/ceilings around you in every subway/train station in the world.
1. Chevy, “Stereotypes”
VIDEO
This list, of course, should be made up of 10 of these Chevy “Real People, Not Actors” ads. I just picked the worst one. (The “breakdancing millennials” spot they mock here would be a much better ad than this commercial.) I don’t care how many Chevrolets this campaign is selling, because it continues to make the world a markedly worse place.
And, it needs to be said, more than a few of the real people in these ads are actors. According to GM, they just don’t have their SAG cards yet. (I don’t believe that either.) But that’s not what makes the spots the shittiest ads of 2016. It’s the cringeworthy dialogue between the coached “people” and the astoundingly annoying and pathetically smarmy host, an actor named Potsch Boyd. Agency: Commonwealth/McCann, Detroit.
RELATED: numbers 11—15 Bottom Ads of 2016.
Related",2017-01-05T05:13:00,
11,ADS,"http://www.bing.com/cr?IG=54B7B76238A1430597B0158CC0F9F43D&CID=23FB5FCB099962F42F6155CA08A863D0&rd=1&h=xfUdwC0G6gAAP2o6O8-gOP_tRngy41o-zFp7zuIfiYQ&v=1&r=http%3a%2f%2fwww.cnn.com%2f2017%2f01%2f04%2fpolitics%2fandy-puzder-democrats-trump-cabinet-fight%2findex.html&p=DevEx,5023.1","(CNN)Democratic senators who sit on the committee that will oversee would-be Labor Secretary Andy Puzder's confirmation hearing plan to drag the fast food CEO through a ringer of comments he's made about women, hoping the comments will give Republicans ...","Democrats have already set their sights on the CKE Restaurants CEO as a top target for the upcoming confirmation battles on Capitol Hill, pointing to labor violations involving CKE's Carl's Jr. and Hardee's restaurants and Puzder's opposition to increasing the minimum wage. But now they are preparing to go after Puzder by pointing to his comments about women and the racy Carl's Jr. ads he's defended, a Senate Democratic aide told CNN on Wednesday.The aide said Democrats hope the line of questioning will draw attention to Puzder's character, while also putting Republicans on the spot.Puzder has frequently defended Carl's Jr. ads featuring bikini-clad models, calling them the core of the restaurant's philosophy, and has said he avoids the sets of those ad shoots because he is ""happily married and would like to stay that way.""When Carl's Jr. released an ad proclaiming it believed in ""putting hot models in our commercials because ugly ones don't sell burgers,"" Puzder called the ad ""the core of what we believe.""""It is not a reinvention of the brands; instead, it is an evolution that refines the core of what we believe,"" Puzder said in a 2011 press release announcing the company's ad, ""Anthem.""And in 2013, he said he avoids the sets of Carl's Jr. ads featuring bikini clad models, saying he has a ""very good marriage"" and wants to ""keep it preserved.""""It certainly raises questions for Democrats that the nominee for Department of Labor would not only advocate for harmful stereotypes about women, but go so far as to say they are at the core of his company's values?"" the aide, who spoke on the condition of anonymity to share the Democrats' strategy, said. ""And given the role that the secretary of labor plays in standing up for women's rights at work, Republicans should be concerned as well.""The Trump transition did not immediately respond to a request for comment.Democrats may also seek to tie Puzder's comments to President-elect Donald Trump's numerous controversial and sexually aggressive comments about women. A Democratic aide said Democrats are eager to see how Republicans react to Puzder's past comments given their criticism of Trump's comments.A half-dozen Republicans on the Senate Committee on Health, Education, Labor and Pensions forcefully criticized Trump over the comments recorded by a hot mic in 2005.But Trump's comments -- in which he bragged about being able to sexually assault women because of his celebrity status -- went much further than anything Puzder has said publicly. Other comments from Trump, including those on Howard Stern's radio show where he rated women on a scale of 1 to 10 and talked about sexual acts he's engaged in, did not draw similar outrage from most Republicans.And even still, only one Republican currently sitting on the committee, Sen. Lisa Murkowski, R-Alaska, said she would not vote for Trump after the 2005 tape surfaced.Others, including Sen. Richard Burr of North Carolina, Sen. Rand Paul of Kentucky, Sen. Orrin Hatch of Utah and even the committee's chairman Sen. Lamar Alexander called Trump's comments everything from ""unacceptable"" to ""disgusting,"" but did not pull their support of the Republican nominee.",2017-01-05T02:34:00,
12,ADS,"http://www.bing.com/cr?IG=54B7B76238A1430597B0158CC0F9F43D&CID=23FB5FCB099962F42F6155CA08A863D0&rd=1&h=_HvxoeOME08iwfcKVDNI_tQsBdmWDmF5Jm2vuGh_lOc&v=1&r=http%3a%2f%2fsearchengineland.com%2f2016-review-insights-search-marketers-bing-ads-266507&p=DevEx,5045.1","2016 marked another year of staggering growth in search as it continues to infuse our lives with more answers, more intelligence and more meaning. It was a year of voice searches, digitized consumer decision journeys, omnichannel shopping, chatbots and ...","2016 marked another year of staggering growth in search as it continues to infuse our lives with more answers, more intelligence and more meaning. It was a year of voice searches, digitized consumer decision journeys, omnichannel shopping, chatbots and disruptive technologies that jolted us forward.
Below are some of the highlights from Bing Ads as we continue to incorporate user feedback into the platform for success into 2017 and beyond, along with some trends we’ve seen on the most competitive and expensive categories of keywords in 2016.
What was new and noteworthy in 2016
Each year, Bing Ads releases hundreds of feature enhancements and new features. It can be difficult to keep up with all the betas, updates and feature releases, so let me highlight a few releases that I was the most excited about in 2016 that you’ll want to make sure you didn’t miss.
Editor for Mac
We heard you! After much input and anticipation, Bing Ads Editor for Mac beta arrived in June to delight users with high speed and ease of use. Users raved about the impact on their work; it saves them hours each day. Just like Bing Ads Editor 11, it included bulk edits, managing multiple accounts at the same time and copy/pasting across multiple accounts.
Bing Shopping Campaigns in Editor
We also heard your feedback that managing Bing Shopping Campaigns directly from the UI is not super-easy. In September, we released Bing Shopping Campaigns integration into Bing Ads Editor, allowing you to efficiently and easily manage shopping campaigns.
Shared Budgets
Users expressed their pain with manually updating individual campaign budgets, which often resulted in underutilized budgets. In October, we delivered Shared Budgets, which automatically distributes a single daily budget across all campaigns or a subgroup of campaigns opted into the shared budget. Users can now enjoy smarter, streamlined budgeting without the hassle of constant juggling and recalculating.
Expanded Text Ads
In an effort to standardize ad formats to work seamlessly across mobile, tablet and desktop devices, we launched an Expanded Text Ads pilot in August. Titles jumped from 25 to 60 characters, while descriptions increased from 71 to 80. This extra space gives users a way to create more compelling calls to action and drive higher conversions.
Broad Match Modifier opportunities
We’ve heard our users express interest in expanding their reach and getting more volume. Broad Match Modifier (BMM) is our exclusive, innovative answer that delivers relevant, high-quality traffic with more precision than broad match alone. It leverages marketplace intelligence to suggest the most optimal BMM keywords for your campaign. Users can find three easy steps on the Opportunities page.
Moments in search
Looking back at 2016, there were moments that captured the spotlight of the world, including the US election, the summer Olympics and the viral sensation Pokémon Go. Discover some of the trends in search that are highlighted by Bing’s key moments in 2016 that you might have missed.
In paid search, one of the trends we saw in Bing Ads was a shift in the most competitive keyword auctions moving from the legal field to rehabilitation and treatment centers.
I know that keyword CPCs can vary a lot based on position and the different modifiers that advertisers place on the keyword. I analyzed our internal Bing Ads data on bidded keywords that received at least 100 clicks during 2016 to remove the one-off instances and outliers of both incredibly high and low CPCs. For instance, one of the most expensive clicks in 2016 was for “houston texas personal injury lawyer” at $167.78.
Then I categorized the keywords by vertical to see what the most competitive keyword auctions are within Bing Ads and what the average CPC was to get into the top spot.
Here is what I found: The most competitive and expensive CPCs are in lucrative industries like health care, education, insurance, legal and financial services.
These industries tend to evaluate customers by lifetime value, not just the value of the revenue from a single transaction or lead generated. The long-term customer value model makes the higher CPCs worthwhile — for example, an online masters degree can cost between $30,000 and $120,000, depending on the school and the program; a drug rehabilitation program can cost upwards of $10,000 per stay; and the legal profession can have billing rates that reach $250/hour. With this in mind, the average ~$40 CPC doesn’t seem as crazy as if you were a retailer whose average order value ranges between $50 and $100.
The most competitive 100 keywords were also spread across the verticals, with 29 percent being in the Education vertical, 27 percent in the Legal vertical, 17 percent in Financial Services and 16 percent in the Health and Medical verticals. What you can’t see reflected in the charts and the graph is the depth of the tail represented in the keywords across each of the verticals.
For example, in the Education vertical, the queries were spread across many different types of degrees and programs, from accounting to construction management. Many of the queries within the Legal vertical included keywords that included specific cities along with variations of lawyer, lawyers, attorney and attorneys. When we look at the spectrum of queries, we can see that the tail is diversifying and that every day there are new queries that we have never seen before.
So what does this mean if you are an advertiser in one of the higher-CPC verticals? If you want to acquire new customers, search is still a great tool for you to do so. Just make sure that you do your research before you get started so you can refine your search campaigns to reach your target market. In my mind, it also goes back to paid search basics and best practices.
So what are the trends in 2016 that surprised you?
Some opinions expressed in this article may be those of a guest author and not necessarily Search Engine Land. Staff authors are listed here.
About The Author
​Christi Olson is a Search Evangelist at Microsoft in Seattle, Washington. For over a decade Christi has been a student and practitioner of SEM. Prior to joining the Bing Ads team within Microsoft, Christi worked in marketing both in-house and at agencies at Point It, Expedia, Harry & David, and Microsoft (MSN, Bing, Windows). When she's not geeking out about search and digital marketing she can be found with her husband at ACUO crossfit and running races across the PacificNW, brewing and trying to find the perfect beer, and going for lots of walks with their two schnauzers and pug.",2017-01-04T19:31:00,
13,ADS,"http://www.bing.com/cr?IG=54B7B76238A1430597B0158CC0F9F43D&CID=23FB5FCB099962F42F6155CA08A863D0&rd=1&h=BaxEA6uIHiN-gXeiGGup0Li7ShPelJKXmWCur5a166c&v=1&r=http%3a%2f%2fwww.huffingtonpost.com%2fentry%2fsteven-mnuchin-treasury-secretary_us_586d075fe4b0d9a5945d466f&p=DevEx,5027.1","WASHINGTON ― A progressive advocacy group focused on holding Wall Street accountable has launched the first major ad campaign since the presidential election, targeting President-elect Donald Trump’s nomination of Steven Mnuchin for Treasury secretary.","WASHINGTON ― A progressive advocacy group focused on holding Wall Street accountable has launched the first major ad campaign since the presidential election, targeting President-elect Donald Trump’s nomination of Steven Mnuchin for Treasury secretary.
The ads, released Wednesday by Allied Progress, urge Sens. Jeff Flake (R-Ariz.) and Dean Heller (R-Nev.) to oppose the nomination of the multimillionaire hedge funder and former Goldman Sachs executive.
The ads highlight Mnuchin’s record as co-owner of OneWest, a bank that profited during the height of the 2008 financial crisis by engaging in an array of unethical practices. Regulators say the bank gave predatory loans to the elderly and aggressively foreclosed on people’s homes. One of those people included a 90-year-old woman who was evicted over 27 cents. The bank was also accused of racist lending practices like redlining against minority groups.
“Mnuchin made millions after his bank foreclosed on homeowners,” the narrator says in the ads. (Liberal billionaire donor George Soros, along with fellow hedge fund manager John Paulson, who is now a Trump supporter, were part of the investment team that purchased the failing bank.)
The 30-second spots, which are backed by a six-figure cable and broadcast buy, begin airing this week in Arizona and Nevada ― two states hit particularly hard by foreclosures during the recession.
“This is a guy who is a predator when it comes to making money. He say an opportunity to profit off the backs of hardworking Americans by taking their homes and he ran with it and he did it,” Karl Frisch, the executive director of Allied Progress, told The Huffington Post on Wednesday.
“To put a finer point on it: The foreclosure crisis did not just hurt people whose homes were taken,” he added. “It devastated communities, driving real estate values into the tank and it may not be the case for Steven Mnuchin or Donald Trump, but for most Americans the family home is the single largest investment and something that most people rely on in retirement. Profound, long-lasting and devastating impact, not just on people whose homes were taken.”
Democrats received more ammo in the fight against Mnuchin’s nomination earlier this week, after The Intercept reported OneWest had engaged in other shady practices. The bank was accused of “widespread misconduct” and there is evidence that it allegedly violated “notice and waiting period statutes, illegally backdated key documents, and effectively gamed foreclosure auctions,” according to a leaked 2013 memo from the California attorney general’s office.
“Steven Mnuchin got over 100,000 homeowners loan modifications and reduced thousands of loan balances,” Tara Bradshaw, a spokeswoman for Mnuchin, told HuffPost. The bank foreclosed on 35,000 homes in California alone, according to the memo published in The Intercept. “OneWest is an American success story,” Bradshaw said, “and Steven looks forward to telling it at his hearing before the Senate Finance Committee.”
Mnuchin is one of several wealthy Goldman Sachs alums Trump has named to his Cabinet ― despite his populist anti-Wall Street rhetoric during the campaign. Last month, the president-elect named Gary Cohn, the president and chief operating officer of Goldman Sachs, to head the National Economic Council. And on Wednesday, Trump nominated Wall Street attorney Jay Clayton to chair the Securities and Exchange Commission.
This article has been updated with comment from Tara Bradshaw.",2017-01-04T11:23:00,
14,ADS,"http://www.bing.com/cr?IG=54B7B76238A1430597B0158CC0F9F43D&CID=23FB5FCB099962F42F6155CA08A863D0&rd=1&h=G6bJDG_3ZPlfPOi58wqW7-X-axbKq-anJlhcuRYxQa8&v=1&r=http%3a%2f%2fwww.recode.net%2f2017%2f1%2f4%2f14169348%2fmedium-layoffs-ad-business-model-change&p=DevEx,5029.1","Medium CEO Ev Williams says his company’s ad-based business model isn’t working, and the startup is laying off 50 employees and closing its offices in New York and Washington, D.C., as a result. That’s about one third of the company’s employees.","Medium CEO Ev Williams says his company’s ad-based business model isn’t working, and the startup is laying off 50 employees and closing its offices in New York and Washington, D.C., as a result.
That’s about one third of the company’s employees.
In a blog post shared on Wednesday, Williams said he wants to move away from ad-supported content, which is how most stuff on the internet generates revenue. Williams described that business model, which is almost entirely dependent on clicks and views, as a “broken system.”
“The vast majority of articles, videos, and other ‘content’ we all consume on a daily basis is paid for  —  directly or indirectly —  by corporations who are funding it in order to advance their goals,” Williams wrote. “And it is measured, amplified, and rewarded based on its ability to do that. Period. As a result, we get … well, what we get. And it’s getting worse.”
So if ad-supported content is no good, what will Medium do instead? Williams hasn’t decided.
“We are shifting our resources and attention to defining a new model for writers and creators to be rewarded, based on the value they’re creating for people,” he wrote. “It is too soon to say exactly what this will look like.”
Medium simply grew too quickly, according to a person close to the company, and laying off 50 people is part of Medium’s plan to cut costs while it figures out what comes next.
Medium has raised more than $130 million from a number of well-known investors, including Andreessen Horowitz, Google Ventures, Greylock and Spark Capital. Its most recent funding round, back in April, valued the company at more than $600 million.",2017-01-04T21:15:00,
15,ADS,"http://www.bing.com/cr?IG=54B7B76238A1430597B0158CC0F9F43D&CID=23FB5FCB099962F42F6155CA08A863D0&rd=1&h=9Mb9-Jn4-jmhekuGsw7_U0lGeaCMajON3EohvSZ-c7s&v=1&r=http%3a%2f%2fcanalcncarauca.com%2f2017%2f01%2f05%2fsanofi-asked-to-pull-vaccine-ads-in-the-philippines.html&p=DevEx,5031.1","The Philippine FDA has ordered the drug giant to stop advertising for dengue vaccination, pointing out that the company's TV and radio ads-as well as promo materials in malls-violate local laws. The FDA said in a statement on Tuesday it issued a summons on ...","The Philippine FDA has ordered the drug giant to stop advertising for dengue vaccination, pointing out that the company's TV and radio ads-as well as promo materials in malls-violate local laws.The FDA said in a statement on Tuesday it issued a summons on December 13 directing the drugmaker to take down the ads for Dengvaxia. It also wrote to television and radio stations, asking them not to air the ads. However, as of December 15, 2016, the company has failed to comply with FDA's directive to take down the said advertisements.For feedback, complaints, or inquiries, contact us. ""Sanofi has also requested a meeting with the FDA to review the legal basis for this apparent decision reversal by the Agency"".
Raiders expected to start Connor Cook vs. Texans
Miami is going to be a significant underdog against the Steelers, a team they beat at full strength in the regular season. They don't have the secondary to hold up if the opposing quarterback can get to his second read, never mind the third.
After over 20 years of business, the break-up came in the wake of poor growth, with Sanofi Pasteur MSD only bringing in sales of €824m in 2015 - less than a fifth of Sanofi's year-end vaccines sales of €4.7bn. In August, an advisory group to the World Health Organization (WHO) recommended the vaccine in countries with high Dengue transmission.""[The advisory group's recommendations] further validate the scientific and medical value of Dengvaxia and send a clear message to endemic countries about the strong public health benefit to be gained by introducing the dengue vaccine in integrated disease management efforts to combat their dengue burden"", Sanofi's President of Global R&D Elias Zerhouni said in an April statement.",2017-01-05T06:23:00,
